obra,autor_yaml,grupo,termo_encontrado,pagina,posicao_no_texto,contexto_antes,trecho_central,contexto_depois,descartado_por_exclusao
latour_2013_aime_en,latour,institution,instituted,1,524082,without a vast number of romance magazines; peoples who have,instituted,"on an unprecedented scale, the professions, societies, technologies, and works",0
latour_2013_aime_en,latour,institution,instituted,1,531280,"of mining; it must be cleared out, shored up, equipped,",instituted,"maintained. To keep it from filling in, one has to",0
latour_2013_aime_en,latour,institution,instituted,1,532152,"objective, the material and the nonmaterial, the personal and the",instituted,"As every urbanist well knows, both the visible city and",0
latour_2013_aime_en,latour,institution,instituting,1,550787,"the contrary, we can install them at last, “seating” them,",instituting,"them, turning them into tutelary divinities. Therapeutic setups offer the",0
latour_2013_aime_en,latour,institution,instituted,1,560827,"really mean by asserting that therapy—a material, collective, and highly",instituted,material technical arrangement— can intervene in such a way that,0
latour_2013_aime_en,latour,institution,institution,1,570957,"from therapeutic treatment, it is because that was the only",institution,"that could give her a handhold. Now, the other 202",0
latour_2013_aime_en,latour,institution,institutions,1,576591,although swimming more than any other people in the diffuse,institutions,"of psychology, remain 204 Reinstituting the Beings of Metamorphosis •",0
latour_2013_aime_en,latour,institution,institute,1,594162,the environment along with the laboratories of the French Research,Institute,for the Exploitation of the Sea. The more one studies,0
latour_2013_aime_en,latour,institution,institution,1,597564,capture. Not only because there is no identifiable domain or,institution,"of technology, but because if we begin to follow the",0
latour_2013_aime_en,latour,institution,institutions,1,646559,they not known how to celebrate them with appro- priate,institutions,232 ·Chapter 9· Situating the Beings of Fiction Multiplying the,0
latour_2013_aime_en,latour,institution,institution,1,647445,"populate a particular crossing, [ficâ•›·â•›ref], where Beings overvalued by the",institution,they undergo a small difference in the disciof works of,0
latour_2013_aime_en,latour,institution,institutions,1,658989,"ferret out so as to extract its mode, which the",institutions,of modernism do not always allow us to recognize. Just,0
latour_2013_aime_en,latour,institution,institution,1,660965,note first of all that the situation in by the,institution,which the Moderns have placed the beings of fiction of,0
latour_2013_aime_en,latour,institution,institutions,1,662991,"or less aggravated by recent history, between contrasts and their",institutions,at first glance the beings of fiction seem to benefit,0
latour_2013_aime_en,latour,institution,institution,1,663517,the same type of reality as the much more recent,institution,of “works of art.” They have been valued to an,0
latour_2013_aime_en,latour,institution,institution,1,675773,"discovery obviously precedes by far the very recent, very Western",institution,"of Art, although that institution has never stopped exploring its",0
latour_2013_aime_en,latour,institution,institution,1,675807,"the very recent, very Western institution of Art, although that",institution,has never stopped exploring its depths and amplifying its contrast.,0
latour_2013_aime_en,latour,institution,institutions,1,715988,that produces immanence. This mode of existence can help define,institutions,"positively, provided that we By following the experience of an",0
latour_2013_aime_en,latour,institution,instituted,1,718075,"altogether; or, on the contrary, it may find itself comfortably",instituted,in institutions adapted to it. By denouncing the deleterious effects,0
latour_2013_aime_en,latour,institution,institutions,1,718098,"on the contrary, it may find itself comfortably instituted in",institutions,adapted to it. By denouncing the deleterious effects of res,0
latour_2013_aime_en,latour,institution,institutions,1,718903,"thought, for it was finally making it possible to overturn",institutions,that were unable to shelter the values they were claiming,0
latour_2013_aime_en,latour,institution,institutions,1,719125,we are obliged to renounce critique and learn to respect,institutions,again—perhaps even to cherish them. This inquiry thus does not,0
latour_2013_aime_en,latour,institution,institution,1,722516,"of imma- nence, as well as of the notion of",institution,we have used and abused up to now without really,0
latour_2013_aime_en,latour,institution,institutions,1,765394,help define in modernism. Yet the opposite is true. Volumes,institutions,"positively, have been written about the importance of science, technology,",0
latour_2013_aime_en,latour,institution,institutions,1,765619,champions. Although it contributes so much to the maintenance of,institutions,"it has benefited, paradoxically, from extremely poor institutional returns. We",0
latour_2013_aime_en,latour,institution,instituted,1,765782,say that the ever-so-subtle contrast of habit has not been,instituted,negatively. This is not going to help the Moderns come,0
latour_2013_aime_en,latour,institution,institutions,1,766425,"wholly external to it and even parasitical, one that opposes",institutions,"it accuses of being routi- nized, artificial, bureaucratic, repetitive, and",0
latour_2013_aime_en,latour,institution,institution,1,767059,"were, “on their margins.” A great iconoclastic temptation: before an",institution,"that one can no longer mend, there is no solution",0
latour_2013_aime_en,latour,institution,institutions,1,768591,"in the intro- duction, that we should “learn to respect",institutions,Unless we know the genealogical cluster in which you are,0
latour_2013_aime_en,latour,institution,instituting,1,768810,"many enemies, whether you want to protect a value by",instituting,"it or, on the contrary, whether you want to betray",0
latour_2013_aime_en,latour,institution,institutions,1,769026,bitter cup to the dregs. Confronting the ruins of the,institutions,"that we are beginning to bequeath to our descendants, am",0
latour_2013_aime_en,latour,institution,institutions,1,769402,"suffering from lung cancer? In the beginning, the struggle against",institutions,seemed to be risk-free; it was modernizing and liberating—and even,0
latour_2013_aime_en,latour,institution,institutions,1,769858,from whom we were threatening to conceal the secret of,institutions,owing to our own congestion (and also owing to our,0
latour_2013_aime_en,latour,institution,institutions,1,770194,"originality of their initiatives, their spontaneity, their enthusiasm, everything that",institutions,were no longer able (and no longer knew how) to,0
latour_2013_aime_en,latour,institution,institutions,1,770339,against blessed habit; it was to claim to be continuing,institutions,without offering any way to ensure continuity. We thought we,0
latour_2013_aime_en,latour,institution,institutions,1,770474,we were protecting values and contrasts by extracting them from,institutions,which we had profited before we destroyed them—like fishermen who,0
latour_2013_aime_en,latour,institution,institutions,1,772218,"to plunge head- long into a search for foundations, since",institutions,"can no longer guar- antee continuity. In other words, to",0
latour_2013_aime_en,latour,institution,instituted,1,772913,also understood that there is nothing true except what is,instituted,"thus what is relative: relative to the weight, the thickness,",0
latour_2013_aime_en,latour,institution,institutions,1,773080,"thickness, the complexity, the layering, the multiplicity, the heterogeneity of",institutions,but relative especially to the always delicate detection of the,0
latour_2013_aime_en,latour,institution,institutions,1,773344,Click teaches us to miss. By confusing the rejuvenation of,institutions,"with their dismantling, hasn’t the baby-boomer generation made it possible",0
latour_2013_aime_en,latour,institution,instituted,1,773736,the radical distinction between what is true and what is,instituted,The late modernism that thought it was digging the grave,0
latour_2013_aime_en,latour,institution,instituted,1,774280,seemed impossible for us to utter the words “truth” and,instituted,"in the same breath, it is surely because of the",0
latour_2013_aime_en,latour,institution,institutions,1,774422,the lamentable state in which we had found the aforementioned,institutions,"If we have criticized them, it is surely because they",0
latour_2013_aime_en,latour,institution,institutions,1,774760,would have been just one way to stand guard over,institutions,while keeping them from degenerating and tipping unnoticed from omission,0
latour_2013_aime_en,latour,institution,institutions,1,775365,a fraction of the energy devoted to the critique of,institutions,"on differentiating all these cares, all these attentions, all these",0
latour_2013_aime_en,latour,institution,institution,1,785588,(they are as impossible to pin down as Proteus). Their,institution,"under the auspices of the psyche defines them only vaguely,",0
latour_2013_aime_en,latour,institution,institution,1,785677,"of the psyche defines them only vaguely, from afar; their",institution,by divinities seems less improbable; yet collectives other than our,0
latour_2013_aime_en,latour,institution,instituted,1,792261,earthenware pot remains in place even though the being that,instituted,"it has disappeared, and it addresses itself to many uses",0
latour_2013_aime_en,latour,institution,institutions,1,796408,"subjectivity and objectivity, before learning to reinstitute it in nonmodern",institutions,that are at last better adapted. For want of an,0
latour_2013_aime_en,latour,institution,institution,1,800236,not to speak of a reli- A powerful but fragile,institution,"to be gious mode, we must not rely on the",0
latour_2013_aime_en,latour,institution,institution,1,806403,"they allowed us, in Chapter 1, to begin to define",institution,by noting the meticulous care the Churches have always invested,0
latour_2013_aime_en,latour,institution,institution,1,808004,"of religion, I don’t lack for domain of Religion an",institution,"it’s the oldest, most meticulous, most widespread, most fastidious of",0
latour_2013_aime_en,latour,institution,instituting,1,808775,"the only contrast, that it should have been intent on",instituting,It is even more astonishing that the institution has been,0
latour_2013_aime_en,latour,institution,institution,1,808836,intent on instituting. It is even more astonishing that the,institution,has been demolished more forcibly by those who call themselves,0
latour_2013_aime_en,latour,institution,institutions,1,813640,we can understand why. Incapable of situating multiform values in,institutions,"made for them, reactionaries of various stripes fall back on",0
latour_2013_aime_en,latour,institution,institute,1,823914,can understand distinguish between why it is as hard to,institute,angels as to institute care and salvation psyches. But there,0
latour_2013_aime_en,latour,institution,institute,1,823937,why it is as hard to institute angels as to,institute,care and salvation psyches. But there is a constant risk,0
latour_2013_aime_en,latour,institution,institution,1,830790,so far removed from “the religious phenomenon” or from the,institution,"of religion, alas, as it has belatedly consented to define",0
latour_2013_aime_en,latour,institution,institution,1,830886,as it has belatedly consented to define itself. The very,institution,that for such a long time had understood this linking,0
latour_2013_aime_en,latour,institution,institution,1,831081,its content— before brutally interrupting its course. With no other,institution,do we find ourselves facing this contradiction between a loss,0
latour_2013_aime_en,latour,institution,institution,1,832614,"As we shall see, it is precisely because the religious",institution,has used and abused the “limits of the rational” that,0
latour_2013_aime_en,latour,institution,instituted,1,836262,theirs: beings come to them and demand that they be,instituted,by them. But these beings have the peculiar feature of,0
latour_2013_aime_en,latour,institution,institution,1,851812,wondered how one could care for the Moderns without an,institution,that conformed to their dealings with metamorphoses: but how can,0
latour_2013_aime_en,latour,institution,institution,1,852096,but If fragility with regard to the precise conditions fragile,institution,of enunciation is such an intimate part of the defi-,0
latour_2013_aime_en,latour,institution,institutions,1,852366,have not developed the most cautious and most subtle of,institutions,for it. But in fact they have done just that!,0
latour_2013_aime_en,latour,institution,institution,1,856490,in too many modes and to establish it as a,institution,The Roman Empire must have weighed rather heavily on its,0
latour_2013_aime_en,latour,institution,institution,1,858950,passage of time. No other mode can offer this; no,institution,"but religion has extracted this contrast, cherished it, amplified it,",0
latour_2013_aime_en,latour,institution,institution,1,879224,"succeed in producing tech- nical drawings adequately depicting nasa, the",institution,within which their rockets flew while they were also flying,0
latour_2013_aime_en,latour,institution,institution,1,883137,"the impossible Circle, which includes or excludes depending on An",institution,legitimately proud of whether it is taken up again or,0
latour_2013_aime_en,latour,institution,institution,1,888534,"of experience. At first glance, approaching the question of An",institution,the political is to take on a domain full of,0
latour_2013_aime_en,latour,institution,institution,1,889236,is at stake here is a common bond where an,institution,"a domain, and a 329 • §3-ch12 contrast to which",0
latour_2013_aime_en,latour,institution,institution,1,911311,are held to that obligation and thus assembled. The political,institution,has to take into account the cosmology and the physics,0
latour_2013_aime_en,latour,institution,institution,1,911963,originality does not seem to have been recognized by the,institution,"that purports to be sheltering it, as if the political",0
latour_2013_aime_en,latour,institution,institutions,1,941975,"judging other phantoms? No, of course not, since, dispersed in",institutions,"buried in practices, captive in our imaginations and in our",0
latour_2013_aime_en,latour,institution,institutions,1,944463,"inevitable [refâ•›·â•›pol]. So much work, so much equipment, so many",institutions,to ensure the service of both! So many hiatuses to,0
latour_2013_aime_en,latour,institution,institution,1,956632,is quite true that a large part of the political,institution,seems to respond rather to the injunction “Eat or be,0
latour_2013_aime_en,latour,institution,institution,1,958996,gone the way of the religious of speaking well while,institution,and whose contrast may have entirely speaking “crooked”? disappeared from,0
latour_2013_aime_en,latour,institution,institution,1,964264,"it promises a fairly satisfying correspondence between a domain, an",institution,"and a contrast whose specificity, technicity, and centrality seem to",0
latour_2013_aime_en,latour,institution,institution,1,967836,"defined in Chapter 10). To put it differently, the legal",institution,does not seem to have suffered as much from the,0
latour_2013_aime_en,latour,institution,institution,1,974181,"with its own regulatory modes, we notice that the legal",institution,is so porous that its decisions look like so many,0
latour_2013_aime_en,latour,institution,institution,1,977265,"rampart against barbarism. Ultimately, despite its seeming homogeneity, the legal",institution,"too, has a proteiform aspect. Having rejoiced too soon at",0
latour_2013_aime_en,latour,institution,institution,1,999899,name of law—while blending it into a necessarily more confused,institution,We can understand why the Moderns have been able to,0
latour_2013_aime_en,latour,institution,instituted,1,1009968,is no “you.” This mode of existence has certainly been,instituted,in a thousand different ways throughout history—from the predication of,0
latour_2013_aime_en,latour,institution,institutions,1,1010185,cannot proceed without losing one’s sense—this particular sense—of personhood. The,institutions,"that fabricate loves and lovers may have various names, but",0
latour_2013_aime_en,latour,institution,institution,1,1032702,together by a more or less The Economy and composite,institution,as she did with the modes ordinary experience. we have,0
latour_2013_aime_en,latour,institution,institution,1,1043524,"first, and we could then explain how the overly composite",institution,"of The Economy had at once revealed them and also,",0
latour_2013_aime_en,latour,institution,institution,1,1068229,some- thing that is going to supply the composite term,institution,with one of its most important features. It doesn’t hold,0
latour_2013_aime_en,latour,institution,institutions,1,1104049,"Its Own Language • beginning to see to what apparatuses,",institutions,"networks, schools, and arrangements one must be connected, what apps",0
latour_2013_aime_en,latour,institution,institution,1,1121404,is what accounts for the obsessive efforts made by every,institution,"to make the distribution of roles, places, and functions as",0
latour_2013_aime_en,latour,institution,institute,1,1138326,"particular beings here, even if they seem very difficult to",institute,"for themselves: beings of passionate interest, or interested passions, as",0
latour_2013_aime_en,latour,institution,institution,1,1210416,all the modes participate in what could be called the,institution,of morality—if there had ever been such a thing. We,0
latour_2013_aime_en,latour,institution,institutions,1,1224677,of all their contrasts must be gathered up in other,institutions,"They may have invented the optimum, and immediately lost it",0
latour_2013_aime_en,latour,institution,institute,1,1241804,than one thread. If The Economy does not manage to,institute,"these three modes of existence while differentiating them, it shares",0
latour_2013_aime_en,latour,institution,institutions,1,1241935,"while differentiating them, it shares this difficulty with all modern",institutions,Let’s not forget that in terms of daily life it,0
latour_2013_aime_en,latour,institution,instituted,1,1250028,as though nothing in The Economy as it has been,instituted,really allowed us to do justice to the experience of,0
latour_2013_aime_en,latour,institution,institutions,1,1252667,for the West to stick with the most badly-put-together of,institutions,"All the more so in that the third contrast, that",0
latour_2013_aime_en,latour,institution,institutions,1,1269023,experiences detected into a diplomatic arrangement so that be shared?,institutions,adjusted to the modes can be designed while a new,0
latour_2013_aime_en,latour,institution,institutions,1,1273017,readers a certain number of tonalities or wavelengths that modern,institutions,in their shambles have made it impossible to capture? Have,0
latour_2013_aime_en,latour,institution,institution,1,1275287,"ask me to go more deeply into each domain, each",institution,"each period, each counter-move of one mode on another, at",0
latour_2013_aime_en,latour,institution,institution,1,1282035,"all the others, but also to be differentiated from the",institution,"that has often betrayed it, as well as from the",0
latour_2013_aime_en,latour,institution,institutions,1,1285130,I have said all sorts of bad things about the,institutions,charged with taking in the famous values that I have,0
latour_2013_aime_en,latour,institution,institution,1,1285273,"in the best possible light. In the final analysis, no",institution,"really stays in place; no domain is really solid, 481",0
latour_2013_aime_en,latour,institution,institutions,1,1285727,diplomat who shows up in the agora saying that the,institutions,all those folks cherish are corrupt will meet with a,0
latour_2013_aime_en,latour,institution,institutions,1,1286197,is more to be gained than lost. ← so that,institutions,Let us recall what is at stake: the institutions adjusted,0
latour_2013_aime_en,latour,institution,institutions,1,1286257,that institutions Let us recall what is at stake: the,institutions,adjusted to the modes have no justification but to take,0
latour_2013_aime_en,latour,institution,institutions,1,1286387,justification but to take in values; without can be designed,institutions,"that are maintained and cherished, only fundamentalism can win. If",0
latour_2013_aime_en,latour,institution,institutions,1,1286499,"that are maintained and cherished, only fundamentalism can win. If",institutions,"start to express the thread of values, why continue to",0
latour_2013_aime_en,latour,institution,institution,1,1286757,"are too distant or too transcendent, why respect them? An",institution,"that is sure of itself is dreadfully worrying, but an",0
latour_2013_aime_en,latour,institution,institution,1,1286835,"that is sure of itself is dreadfully worrying, but an",institution,that is afraid of losing its treasure is not reassuring,0
latour_2013_aime_en,latour,institution,institutions,1,1289563,about and can at last share the secrets of their,institutions,"with the others! I have often wondered, contemplating the mutilated",0
latour_2013_aime_en,latour,institution,institute,1,1299874,what hiatus and what trajectory are they felicity/infelicity beings to,institute,"alteration name conditions Lines of force, Continue, inherit, disappear Explore",0
latour_2013_aime_en,latour,institution,institute,1,1303419,conditions? (column 3); what beings must they be prepared to,institute,"(column 4); finally, to what alteration is being-as-other subjected in",0
latour_2013_aime_en,latour,domain_category,domain,1,4538,off to do fieldwork among the Moderns (28) without respecting,domain,"bounda- ries, thanks to the notion of actor-network (30), which",0
latour_2013_aime_en,latour,domain_category,domain,1,5048,of “boundary” that does not depend on the notions of,domain,or network (38). The mode of extension of objective knowledge,0
latour_2013_aime_en,latour,domain_category,category mistakes,1,6149,. . 47 The inquiry begins with the detection of,category mistakes,"(48), not to be confused with first-degree mistakes (49); only",0
latour_2013_aime_en,latour,domain_category,crossings,1,6936,with understandings of the prepositional type [pre] (61) by defining,crossings,that form a Pivot Table (63). A somewhat peculiar [netâ•›·â•›pre],0
latour_2013_aime_en,latour,domain_category,crossing,1,7013,that form a Pivot Table (63). A somewhat peculiar [netâ•›·â•›pre],crossing,"(63), which raises a problem of compatibility with the actornetwork",0
latour_2013_aime_en,latour,domain_category,crossing,1,8608,"mode of existence, [rep], for reproduction (91) and of a",crossing,[repâ•›·â•›ref] that is hard to keep in sight (93) especially,0
latour_2013_aime_en,latour,domain_category,crossing,1,9517,of matter (105) by the proper use of the [repâ•›·â•›ref],crossing,"(106). Now, as soon as we begin to distinguish two",0
latour_2013_aime_en,latour,domain_category,crossing,1,11450,"(129). Fortunately, the method that allows us to recognize a",crossing,(131) will succeed in identifying a veridic- tion proper to,0
latour_2013_aime_en,latour,domain_category,crossing,1,16351,explains why invisibility is among their specifications (202). The [repâ•›·â•›met],crossing,"is of capital importance (202), but it has been addressed",0
latour_2013_aime_en,latour,domain_category,crossing,1,17277,relation (217). By drawing out the lessons of the [repâ•›·â•›ref],crossing,on this point (219) we shall no longer confuse tech-,0
latour_2013_aime_en,latour,domain_category,crossing,1,19309,beyond the work of art (249); they populate a particular,crossing,"[ficâ•›·â•›ref] (250), where they undergo a small difference in the",0
latour_2013_aime_en,latour,domain_category,domain,1,22587,"(297), we must not rely on the limits of the",domain,of Religion (298) but instead return to the experience of,0
latour_2013_aime_en,latour,domain_category,crossing,1,22823,we distinguish between care and salvation as we explore their,crossing,[metâ•›·â•›rel] (304). We then discover a specific hiatus (305) that,0
latour_2013_aime_en,latour,domain_category,crossing,1,23494,protected (314) as much against the misunderstandings of the [relâ•›·â•›pre],crossing,(315) as against those of the [metâ•›·â•›rel] crossing (316) and,0
latour_2013_aime_en,latour,domain_category,crossing,1,23549,the [relâ•›·â•›pre] crossing (315) as against those of the [metâ•›·â•›rel],crossing,"(316) and the [refâ•›·â•›rel] crossing, which produces unwarranted rationalizations (318).",0
latour_2013_aime_en,latour,domain_category,crossing,1,23588,against those of the [metâ•›·â•›rel] crossing (316) and the [refâ•›·â•›rel],crossing,which produces unwarranted rationalizations (318). xiii Rationalization is what produces,0
latour_2013_aime_en,latour,domain_category,crossing,1,25540,"a particularly demanding type of veridiction (348), which the [refâ•›·â•›pol]",crossing,misunderstands (349). [pol] practices a very distinctive extraction of alterity,0
latour_2013_aime_en,latour,domain_category,crossing,1,30700,kneading of existents (437) leads to the enigma of the,crossing,"with organization [attâ•›·â•›org] (438), which will allow us to disamalgamate",0
