obra,autor_yaml,grupo,termo_encontrado,pagina,posicao_no_texto,contexto_antes,trecho_central,contexto_depois,descartado_por_exclusao
latour_2013_aime_en,latour,moderns,modernity,1,324885,this confusion seems to be central to the definition of,modernity,Why? Because an accident of history has come along to,0
latour_2013_aime_en,latour,moderns,moderns,1,325426,"when the res extensa is being invented, around Descartes. The",Moderns,is what will define them—begin to believe that the thought,0
latour_2013_aime_en,latour,moderns,moderns,1,341153,theory and practice that is so charac- teristic of the,Moderns,"Because of this Bifurcation, or, better, these multiple Bifurcations, we",0
latour_2013_aime_en,latour,moderns,moderns,1,342394,been sustained and extended to everything and everyone by the,Moderns,"it has reached the point of defining solid, serious, brute",0
latour_2013_aime_en,latour,moderns,moderns,1,342616,No one believes himself to be a realist—not among the,Moderns,at least—if he is not a “materialist” in the sense,0
latour_2013_aime_en,latour,moderns,moderns,1,343382,like zombies. The reader unfamiliar with the anthropology of the,Moderns,will object that putting Mont Aiguille through such an indignity,0
latour_2013_aime_en,latour,moderns,moderns,1,346443,of matter at the heart of the history of the,Moderns,This is what has brought about the quite peculiar designation,0
latour_2013_aime_en,latour,moderns,moderns,1,347349,the motives at the heart of the rationalism to which,Moderns,believe they must cling as to the apple of their,0
latour_2013_aime_en,latour,moderns,moderns,1,352746,have been able to define no more do justice the,Moderns,as a people who believe themselves to the world than,0
latour_2013_aime_en,latour,moderns,moderns,1,352905,materialist and despair at the thought. For “lived experience.” the,Moderns,are never entirely comfortable with this position. Who would want,0
latour_2013_aime_en,latour,moderns,moderns,1,353308,even let us do justice to the values of the,Moderns,"to the values they themselves most obviously hold dear, and,",0
latour_2013_aime_en,latour,moderns,moderns,1,356777,sources of pride! We should not be astonished that the,Moderns,have been rather surprised to see the specter of Gaia,0
latour_2013_aime_en,latour,moderns,moderns,1,360791,since all the questions that make the anthropology of the,Moderns,so obscure have played out over time around the place,0
latour_2013_aime_en,latour,moderns,moderns,1,361341,"In particular, we would have been obliged to consider the",Moderns,as “naturalists” and thus forced to share the prejudice with,0
latour_2013_aime_en,latour,moderns,moderns,1,361749,"“symbolic and moral dimensions,” it is certainly that of the",Moderns,the idealism of the Moderns’ materialism is what strikes our,0
latour_2013_aime_en,latour,moderns,moderns,1,361778,is certainly that of the Moderns: the idealism of the,Moderns,"materialism is what strikes our ethnographer, on the contrary. We",0
latour_2013_aime_en,latour,moderns,moderns,1,362567,"though experience is so contrary to it. In fact, the",Moderns,"do not live, any more than other peoples do, in",0
latour_2013_aime_en,latour,moderns,moderns,1,363081,the anthropology of the ← it was because of an,Moderns,when we discover the curious link they insistence on “straight,0
latour_2013_aime_en,latour,moderns,moderns,1,363506,"a conjunction, a convergence of circumstances that determined for the",Moderns,"over a very long period of time, all the ways",0
latour_2013_aime_en,latour,moderns,moderns,1,369997,strikes every ethnographer of the ← it leads to the,Moderns,is not that straight talk has the slightest disqualification of,0
latour_2013_aime_en,latour,moderns,moderns,1,373194,"sight, and with it, of course, any possibility that the",Moderns,"may be empirical, that is, may draw lessons from their",0
latour_2013_aime_en,latour,moderns,moderns,1,373590,"gled: the principal impediment to speech among politics [refâ•›·â•›pol], the",Moderns,comes precisely from their strange idea of a speech that,0
latour_2013_aime_en,latour,moderns,moderns,1,374727,managed to jot down this observation in her notebook: “The,Moderns,are those who have kidnapped Science to solve a problem,0
latour_2013_aime_en,latour,moderns,moderns,1,377648,res ratiocinans. A determining invention for the idea that the,Moderns,"come to have about themselves. It is indeed a res,",0
latour_2013_aime_en,latour,moderns,moderns,1,380845,"is still under dispute, but it seems as though the",Moderns,may have actually been the only people in the world,0
latour_2013_aime_en,latour,moderns,moderns,1,381726,opposition between Reason and Politics the preferred Gigantomachy of the,Moderns,But we now know how to proceed: frontal opposition doesn’t,0
latour_2013_aime_en,latour,moderns,moderns,1,391119,value. Here is surely a mode of veridiction that the,Moderns,"who are so proud of it, would not want to",0
latour_2013_aime_en,latour,moderns,moderns,1,393992,on both counts. If there is a crossing that the,Moderns,ought to have protected like the apple of their eye,0
latour_2013_aime_en,latour,moderns,moderns,1,400172,"here that explains in large part the gap, among the",Moderns,between theory and practice: how could people who agree—first stage—to,0
latour_2013_aime_en,latour,moderns,moderns,1,400568,in all its twists and turns the relation between the,Moderns,and that astonishing speech device the “voice of facts” discussed,0
latour_2013_aime_en,latour,moderns,moderns,1,401693,losing the dream of straight talk? This is what the,Moderns,"seem to believe. How strange they are: they had language,",0
latour_2013_aime_en,latour,moderns,moderns,1,403397,speech that takes itself in hand. Can we reassure the,Moderns,on this point? Assure them that this speech will offer,0
latour_2013_aime_en,latour,moderns,moderns,1,405560,same problem: reality and language. If the ethnologist of the,Moderns,"accepts this distinction, and she is well aware of this,",0
latour_2013_aime_en,latour,moderns,moderns,1,415287,"to speak pology, it is because there is, among the",Moderns,of values without a very strange feature that consists in,0
latour_2013_aime_en,latour,moderns,moderns,1,416598,these representations maintained with “reality.” But the anthropologists of the,Moderns,are going to have to learn to address “us.” Consequently,0
latour_2013_aime_en,latour,moderns,moderns,1,419503,probably jotted this down in her notebook: “Definition of the,Moderns,they believe in language as an autonomous domain that is,0
latour_2013_aime_en,latour,moderns,moderns,1,424024,"fieldwork to notice that dichotomies do not have, among the",Moderns,"in any case, the extraordinary explanatory virtue that the anthropology",0
latour_2013_aime_en,latour,moderns,moderns,1,427421,"of existence, it means the world is pretty vast!” The",Moderns,"protest: “That makes for too many beings, far too many",0
latour_2013_aime_en,latour,moderns,moderns,1,429841,see why it is so problematic to say that the,Moderns,"inherited Reason: this legacy hides a treasure, but one crippled",0
latour_2013_aime_en,latour,moderns,moderns,1,430528,takes time to learn to talk. The anthropologist of the,Moderns,"slowly resumes speaking, catches her breath, resists the temp- tation",0
latour_2013_aime_en,latour,moderns,moderns,1,431130,"take another step, by exploring the doubt introduced by the",Moderns,"not about the link between the world and words, this",0
latour_2013_aime_en,latour,moderns,moderns,1,431474,as a guide for understanding what has happened to the,Moderns,and what they can decide to inherit. 149 ·Chapter 6·,0
latour_2013_aime_en,latour,moderns,moderns,1,431827,inquiring into the We then find ourselves facing a meth-,Moderns,"comes from the impossibility of odological quandary, which obliges us",0
latour_2013_aime_en,latour,moderns,moderns,1,433161,detecting the double root of the double language of the,Moderns,arising We thus have to shift to the concept from,0
latour_2013_aime_en,latour,moderns,moderns,1,433967,inquiring into the on the possibility of establishing a dis-,Moderns,tinction between the Moderns’ experi- ence of their values and,0
latour_2013_aime_en,latour,moderns,moderns,1,434012,the possibility of establishing a dis- Moderns tinction between the,Moderns,experi- ence of their values and the account they give,0
latour_2013_aime_en,latour,moderns,moderns,1,434268,decides that it is not at all a “remnant”! The,Moderns,new situation of relative weakness offers an excellent opportunity to,0
latour_2013_aime_en,latour,moderns,moderns,1,435669,of daily life and the limits of vocabulary. Among the,Moderns,"this gap has become a major contradiction, one that accounts",0
latour_2013_aime_en,latour,moderns,moderns,1,444289,"the demands of Reason (exaggerated demands, to be sure), the",Moderns,"have destroyed, 155 • §1-ch6 one after another, the mediators",0
latour_2013_aime_en,latour,moderns,moderns,1,445801,"a fairly innocuous passion—since at all events, in practice, the",Moderns,"have always done just the opposite and multiplied media- tions,",0
latour_2013_aime_en,latour,moderns,moderns,1,446134,of the world led the others to believe what the,Moderns,were saying about themselves! “We” know perfectly well that we,0
latour_2013_aime_en,latour,moderns,modernization,1,446548,keeping the antidote for ourselves. The more or less failed,modernization,of the other cultures was a source of amusement for,0
latour_2013_aime_en,latour,moderns,modernity,1,446805,"by contrasts,” we would say with a little smile, “between",modernity,"and tradition.” As if we ourselves were not torn, we",0
latour_2013_aime_en,latour,moderns,modernization,1,447043,everything has changed; “the others” have absorbed enormous doses of,modernization,"they have become powerful, they imitate us admirably, except that",0
latour_2013_aime_en,latour,moderns,modernity,1,449475,which we forgot to include in the instruction manual for,modernity,"when we exported it. To say that something—a scientific fact,",0
latour_2013_aime_en,latour,moderns,moderns,1,454444,"constructivism how hard it is, when one lives among the",Moderns,does not succeed in not to be mistaken about oneself:,0
latour_2013_aime_en,latour,moderns,moderns,1,455790,constructed. 159 • §1-ch6 What is astonishing is that the,Moderns,"all live surrounded by constructions, within the most artificial worlds",0
latour_2013_aime_en,latour,moderns,moderns,1,466017,argument that would otherwise remain overly abstract: why have the,Moderns,restricted themselves to such a small number of ontological templates,0
latour_2013_aime_en,latour,moderns,moderns,1,466353,these are precisely what we have trouble finding among the,Moderns,and this is why it is so hard for the,0
latour_2013_aime_en,latour,moderns,moderns,1,466400,and this is why it is so hard for the,Moderns,to encounter other collectives except in the form of “cultures.”,0
latour_2013_aime_en,latour,moderns,moderns,1,466534,"In the previous chapters, we have seen why: either the",Moderns,"find themselves face to face with obtuse raw materiality, or",0
latour_2013_aime_en,latour,moderns,moderns,1,468892,"chains of reference, how to understand creation—that has thrust the",Moderns,into such a passion for obscurity and compromised everything they,0
latour_2013_aime_en,latour,moderns,moderns,1,469948,we must now approach with fear and trembling. If the,Moderns,"had confused only the sources of the Science, their anthropology",0
latour_2013_aime_en,latour,moderns,moderns,1,470463,is the most striking feature of the anthropology of the,Moderns,they believe that they are anti-idolators and antifetishists. So we,0
latour_2013_aime_en,latour,moderns,moderns,1,470578,antifetishists. So we are going to act as though the,Moderns,← iconoclasm and the had been victims of an accident,0
latour_2013_aime_en,latour,moderns,moderns,1,473067,"to be plunged. Or misunderstood idols rather, since among the",Moderns,"everything always happens “doubled,” we are going to find ourselves",0
latour_2013_aime_en,latour,moderns,moderns,1,474514,"to misunderstand them, to get them wrong, mistake them. The",Moderns,engage in the phony history of believing themselves to be,0
latour_2013_aime_en,latour,moderns,moderns,1,479281,speaking from the start about the double language of the,Moderns,it is clear by now that there were good reasons,0
latour_2013_aime_en,latour,moderns,moderns,1,480940,and the most secular of persons. The anthropologist of the,Moderns,thus has to get used to living in a cloud,0
latour_2013_aime_en,latour,moderns,moderns,1,482632,of his victim—swimming pool or church. (Anyone who accepts the,Moderns,"claim to have had, at least, the immense merit of",0
latour_2013_aime_en,latour,moderns,moderns,1,483811,that defines rather precisely what can be expected of the,Moderns,when they believe they are disabused. These blind folks are,0
latour_2013_aime_en,latour,moderns,moderns,1,486695,an astonishing error that says a great deal about the,Moderns,"capacity for self-knowledge, is also the mistake that has been",0
latour_2013_aime_en,latour,moderns,moderns,1,487461,believed—in any case not in the way in which the,Moderns,"believe that the others believe. In short, a Modern is",0
latour_2013_aime_en,latour,moderns,moderns,1,491349,to interpret the instauration of those beings to which the,Moderns,are right to want to cling. This is the only,0
latour_2013_aime_en,latour,moderns,moderns,1,491939,ered in the previous chapter and this adventure of the,Moderns,antifetishism—which would warrant detailed study on its own account. If,0
latour_2013_aime_en,latour,moderns,moderns,1,493014,of the double source of the double language of the,Moderns,The prerequisite was the impromptu encounter (it is up to,0
latour_2013_aime_en,latour,moderns,moderns,1,495745,"the Whites are of the cleft genre. Yes, unquestionably, the",Moderns,are serious bifurcators. When they speak indignantly about “chasing out,0
latour_2013_aime_en,latour,moderns,moderns,1,496532,"knowl- edge produces assured—and in some cases even apodictic—results, the",Moderns,tried to explain this miracle by acting as though the,0
latour_2013_aime_en,latour,moderns,moderns,1,497469,"not have become our seemingly insurmount- able horizon, if the",Moderns,had not tied it to the passion for knowledge. Without,0
latour_2013_aime_en,latour,moderns,moderns,1,499207,but the diagnosis was accurate: at the core of the,Moderns,"there is a source of foundational irrationality, since they must",0
latour_2013_aime_en,latour,moderns,moderns,1,500363,there is one thing one could not require of the,Moderns,it is that they be faithful to what is given,0
latour_2013_aime_en,latour,moderns,moderns,1,501121,"ahead, unaware of danger (this is the hubris of the",Moderns,"But if he begins to hesitate, he ends up discouraged",0
latour_2013_aime_en,latour,moderns,moderns,1,502129,we are not resolved to repopulate the world that the,Moderns,actually inhabit but that they believe they have been obliged,0
latour_2013_aime_en,latour,moderns,moderns,1,503342,"choose between representa- tions and things. Up to now, the",Moderns,"thought they had to refer to “fictional beings,” “gods,” “idols,”",0
latour_2013_aime_en,latour,moderns,moderns,1,504156,"Which does not mean, as we have understood, that the",Moderns,"were “materialists,” since we now know how res extensa, cogitans",0
latour_2013_aime_en,latour,moderns,moderns,1,507689,of capturing the modes of existence thanks to which the,Moderns,could get a new grip on themselves and discern for,0
latour_2013_aime_en,latour,moderns,moderns,1,508802,had been deprived in advance. We can understand that the,Moderns,"with such a definition of the “concrete,” had some difficulty",0
latour_2013_aime_en,latour,moderns,moderns,1,514631,on two contrasting examples. It is often claimed that the,Moderns,have put an end to the irrationality of superstitions and,0
latour_2013_aime_en,latour,moderns,modernization,1,514919,"of endlessly extending the pioneering front, the war front of",modernization,"To discover exactly what to make of this frontier, we",0
latour_2013_aime_en,latour,moderns,moderns,1,515381,"positive, whose oscillation very largely determines the anthropology of the",Moderns,Let’s begin with the charge of superstition. ← while trying,0
latour_2013_aime_en,latour,moderns,moderns,1,517195,"Part One, we saw that the “healthy materialism” of the",Moderns,“good old good sense” captures the experience of knowledge as,0
latour_2013_aime_en,latour,moderns,moderns,1,517356,does that of the repro- duction of existents. Perhaps the,Moderns,lack an adequate way to grasp those beings to which,0
latour_2013_aime_en,latour,moderns,moderns,1,519689,her part not to rush too quickly toward what the,Moderns,"designate as “subjects” and “subjectivity.” The two directions are linked,",0
latour_2013_aime_en,latour,moderns,moderns,1,520134,to discover that psychology plays the same role among the,Moderns,"as epistemology, but in inverted fashion: whereas the latter exaggerated",0
latour_2013_aime_en,latour,moderns,moderns,1,520453,we make an effort work at determining whether among the,Moderns,to grasp the networks there are networks for the production,0
latour_2013_aime_en,latour,moderns,moderns,1,520951,"other peoples can, but it is quite possible that the",Moderns,deceive themselves when they declare that they are entirely freed,0
latour_2013_aime_en,latour,moderns,moderns,1,522166,human mind? You’re not really going to argueÂ€. . .Â€The,Moderns,"can be mistaken about themselves, but not to that point.",0
latour_2013_aime_en,latour,moderns,moderns,1,528939,and the means of knowl- edge remains invisible to the,Moderns,so the infrastructure that author- izes them to possess a,0
latour_2013_aime_en,latour,moderns,moderns,1,529977,"advancing in exteriority. Because of their theory of objects, the",Moderns,do not seem to have any place to put the,0
latour_2013_aime_en,latour,moderns,moderns,1,530929,"what was anticipated in the too-quickly-saturated vessel of exteriority, the",Moderns,"could be said to have gotten rid of them, there’s",0
latour_2013_aime_en,latour,moderns,moderns,1,532457,"down, to equip, illuminate, maintain, and move subjects around. The",Moderns,"have big egos, it’s true, but if we listen carefully,",0
latour_2013_aime_en,latour,moderns,moderns,1,533441,we run the risk of committing with regard to the,Moderns,the same mistake we often make when we see someone,0
latour_2013_aime_en,latour,moderns,moderns,1,535315,keep on going even after we die. And yet the,Moderns,persist in describing the “self ” as if it were,0
latour_2013_aime_en,latour,moderns,moderns,1,545395,"exorcism. Isn’t it in these arrangements, at least among the",Moderns,that we verify day 193 • §2-ch7 by day what,0
latour_2013_aime_en,latour,moderns,modernism,1,559107,truth. But what consistency? ← that can be followed In,modernism,"one cannot avoid approaching rationally, them by asking this one",0
latour_2013_aime_en,latour,moderns,moderns,1,571500,"“outer world”—which cannot capture, as we now understand, either the",Moderns,"or the others? This is not impossible if, in order",0
latour_2013_aime_en,latour,moderns,modernization,1,574227,stand the total misunderstanding created by the anthropology a new,modernization,front. By requiring that the beings basis for negotiations. of,0
latour_2013_aime_en,latour,moderns,moderns,1,574467,"beings of metamorphosis be taken for an “inner world,” the",Moderns,could not understand themselves any better than they could understand,0
latour_2013_aime_en,latour,moderns,moderns,1,574732,is all the more strange in that they offered the,Moderns,"a unique opportu- nity to enter into contact, on an",0
latour_2013_aime_en,latour,moderns,moderns,1,575336,"quite systematically, has no form of official existence among the",Moderns,It is not surprising that the colonizers kept going from,0
latour_2013_aime_en,latour,moderns,moderns,1,576511,under the auspices of “matter.” The result is that the,Moderns,although swimming more than any other people in the diffuse,0
latour_2013_aime_en,latour,moderns,moderns,1,577082,any cosmology. As if there were something diabolical in the,Moderns,insistence on the internal origin of their emotions: this division,0
latour_2013_aime_en,latour,moderns,moderns,1,577308,about it. Whence the anxiety of our anthropologist: aren’t the,Moderns,dangerously alienated? Wouldn’t that explain a large part of their,0
latour_2013_aime_en,latour,moderns,moderns,1,579325,reader: by trying to define the rela- tions that the,Moderns,maintain with the beings of met- amorphosis—relations limited to beings,0
latour_2013_aime_en,latour,moderns,moderns,1,579682,have simply tried to understand why the cosmology of the,Moderns,"remains so hard to retrace, so contradictory to the les-",0
latour_2013_aime_en,latour,moderns,modernism,1,580029,to capture beings that enjoy an entirely different status in,modernism,"“The modernization front al- lowed the Moderns to represent themselves,”",0
latour_2013_aime_en,latour,moderns,modernization,1,580045,beings that enjoy an entirely different status in modernism. “The,modernization,"front al- lowed the Moderns to represent themselves,” we speculated,",0
latour_2013_aime_en,latour,moderns,moderns,1,580088,different status in modernism. “The modernization front al- lowed the,Moderns,"to represent themselves,” we speculated, “as the peo- ple who",0
latour_2013_aime_en,latour,moderns,moderns,1,581363,"the not-so-very material matter, that “idealism of materialism” of the",Moderns,"In turning toward the craftsmen, the ingenious engineers who actually",0
latour_2013_aime_en,latour,moderns,moderns,1,581682,"our ethnologist, one of the most astonishing aspects of the",Moderns,"is not the way they treat divinities, knowledge, or gods,",0
latour_2013_aime_en,latour,moderns,moderns,1,584649,to come to terms with psychogenic beings. How have the,Moderns,"managed to miss the strangeness, the ubiquity, and yes, the",0
latour_2013_aime_en,latour,moderns,moderns,1,607993,matter. If we want to measure the gulf that the,Moderns,are capable of digging between practice and the account of,0
latour_2013_aime_en,latour,moderns,moderns,1,613286,suffer from being misun- derstood; technicians fare no better. The,Moderns,"view them as scien- tists, but of lower rank—and they",0
latour_2013_aime_en,latour,moderns,moderns,1,616331,“technical fix.” A strange blindness on the part of the,Moderns,"toward the most precious source of all beauty, all comfort,",0
latour_2013_aime_en,latour,moderns,moderns,1,621291,"I am simply saying that if you are capable, you",Moderns,of leaving out the paths of reference when you speak,0
latour_2013_aime_en,latour,moderns,modernization,1,645395,be set up when we have to dismantle the impossible,modernization,front. If the verb “ecologize” is to become an alternative,0
latour_2013_aime_en,latour,moderns,moderns,1,646244,What? Are we going to have to restore to the,Moderns,not only the beings that engender psyches but also resuscitate,0
latour_2013_aime_en,latour,moderns,moderns,1,650254,• we might be in a position to offer the,Moderns,"a wholly different version of what they care about. Curiously,",0
latour_2013_aime_en,latour,moderns,moderns,1,652315,[pol]—over the realm of the primary qualities has obliged the,Moderns,to group together somewhere all the secondary qualities on which,0
latour_2013_aime_en,latour,moderns,moderns,1,652714,"qualities—which are devoid of all “human” signification, moreover. Thus the",Moderns,find themselves faced with the rather thankless 235 • §2-ch9,0
latour_2013_aime_en,latour,moderns,moderns,1,653719,"who do not even notice that it is missing, the",Moderns,"were driven out of the reality that is real but,",0
latour_2013_aime_en,latour,moderns,moderns,1,654258,which was blocking the way to any anthropology of the,Moderns,we now have to remove the obstacle of “Language.” As,0
latour_2013_aime_en,latour,moderns,modernism,1,659005,"so as to extract its mode, which the institutions of",modernism,do not always allow us to recognize. Just as matter,0
latour_2013_aime_en,latour,moderns,moderns,1,660123,with their proper consistency. We would then understand why the,Moderns,thought they were making the symbolic a separate world: just,0
latour_2013_aime_en,latour,moderns,moderns,1,660992,all that the situation in by the institution which the,Moderns,have placed the beings of fiction of works of art,0
latour_2013_aime_en,latour,moderns,moderns,1,663165,"be appreciated for what they are. And yet, with the",Moderns,nothing is ever ← and yet deprived of simple. If,0
latour_2013_aime_en,latour,moderns,moderns,1,669295,"ontological realism, the reader should remember that the world the",Moderns,"are going to be able to penetrate is now spacious,",0
latour_2013_aime_en,latour,moderns,moderns,1,704630,"what Philippe Descola calls naturalism, something that has deprived the",Moderns,of the possibility of understanding those who had never combined,0
latour_2013_aime_en,latour,moderns,moderns,1,716773,"Every time they manage to extract a new contrast, the",Moderns,"have a tendency to weaken or, on the contrary, to",0
latour_2013_aime_en,latour,moderns,moderns,1,720782,enigma is more exciting than the one offered by the,Moderns,How could anyone have expected them to succeed in housing,0
