obra,autor_yaml,grupo,termo_encontrado,pagina,posicao_no_texto,contexto_antes,trecho_central,contexto_depois,descartado_por_exclusao
latour_2013_aime_en,latour,trajectory_pass,hiatus,1,139503,distinguished a trajectory characterized in its turn by a particular,hiatus,"between elements so dissimilar that, without this trajectory, they would",0
latour_2013_aime_en,latour,trajectory_pass,trajectory,1,139560,"a particular hiatus between elements so dissimilar that, without this",trajectory,they would never have lined up in any kind of,0
latour_2013_aime_en,latour,trajectory_pass,trajectory,1,139630,never have lined up in any kind of order. This,trajectory,"made of discontinuous leaps, is what allows a researcher to",0
latour_2013_aime_en,latour,trajectory_pass,leaps,1,139664,"in any kind of order. This trajectory, made of discontinuous",leaps,"is what allows a researcher to determine that, for example,",0
latour_2013_aime_en,latour,trajectory_pass,course of action,1,140415,"our ethnographer is that, again, for someone looking at this",course of action,"from the outside, each step in the proofs is marked",0
latour_2013_aime_en,latour,trajectory_pass,discontinuity,1,140508,each step in the proofs is marked by an abrupt,discontinuity,an equation does not “resemble” a table of figures any,0
latour_2013_aime_en,latour,trajectory_pass,continuity,1,140904,"person who is operating within this network, there is indeed",continuity,"Or rather, however strange the list of ingredients that make",0
latour_2013_aime_en,latour,trajectory_pass,continuity,1,141721,trades are nevertheless distinguished by the same capacity to grasp,continuity,through a series of discontinuities—and then to grasp another continuity,0
latour_2013_aime_en,latour,trajectory_pass,discontinuities,1,141763,the same capacity to grasp continuity through a series of,discontinuities,then to grasp another continuity by passing through another discontinuity.,0
latour_2013_aime_en,latour,trajectory_pass,continuity,1,141805,continuity through a series of discontinuities—and then to grasp another,continuity,by passing through another discontinuity. So now the ethnologist is,0
latour_2013_aime_en,latour,trajectory_pass,discontinuity,1,141854,discontinuities—and then to grasp another continuity by passing through another,discontinuity,So now the ethnologist is in possession of a new,0
latour_2013_aime_en,latour,trajectory_pass,continuities,1,143721,"pass in order to carry it out; this movement, between",continuities,consisting of a series of leaps (identified by the and,0
latour_2013_aime_en,latour,trajectory_pass,leaps,1,143760,"out; this movement, between continuities consisting of a series of",leaps,(identified by the and discontinuities. surprises encountered by the ethnologist,0
latour_2013_aime_en,latour,trajectory_pass,discontinuities,1,143801,consisting of a series of leaps (identified by the and,discontinuities,"surprises encountered by the ethnologist and her informants), traces a",0
latour_2013_aime_en,latour,trajectory_pass,trajectories,1,145687,"given situation, the value that emanates from that situation. These",trajectories,have the same general form as those of a [net].,0
latour_2013_aime_en,latour,trajectory_pass,leaps,1,145772,as those of a [net]. They too are defined by,leaps,"discontinuities, hiatuses. But unlike networks, they create sequences that do",0
latour_2013_aime_en,latour,trajectory_pass,discontinuities,1,145779,"those of a [net]. They too are defined by leaps,",discontinuities,"hiatuses. But unlike networks, they create sequences that do not",0
latour_2013_aime_en,latour,trajectory_pass,continuity,1,145942,"lists of unexpected actors, but rather to a type of",continuity,specific 41 • §1-ch1 to each instance. Our investigator has,0
latour_2013_aime_en,latour,trajectory_pass,continuity,1,146306,"third, networks— in the [net] sense—through which one ultimately obtains",continuity,"through the intermediary of discontinuities, unexpected associations, that are revealed",0
latour_2013_aime_en,latour,trajectory_pass,discontinuities,1,146356,sense—through which one ultimately obtains continuity through the intermediary of,discontinuities,"unexpected associations, that are revealed by the course of the",0
latour_2013_aime_en,latour,trajectory_pass,hiatus,1,149640,shall see in Chapter 11). Here again we find a,hiatus,"an agonizing one during which a priest, a bishop, a",0
latour_2013_aime_en,latour,trajectory_pass,continuity,1,150260,"and spread throughout the world. A new pass, a new",continuity,"obtained by the identification, always to be begun anew and",0
latour_2013_aime_en,latour,trajectory_pass,discontinuities,1,150348,"identification, always to be begun anew and always risky, of",discontinuities,that appear from the outside as so many non sequiturs—not,0
latour_2013_aime_en,latour,trajectory_pass,trajectory,1,173456,"key in which she has to grasp the direction, the",trajectory,the movement of what is being assertedÂ€. . .Â€The trajectory,0
latour_2013_aime_en,latour,trajectory_pass,trajectory,1,173530,"trajectory, the movement of what is being assertedÂ€. . .Â€The",trajectory,is the sense in which a course of action has,0
latour_2013_aime_en,latour,trajectory_pass,course of action,1,173576,assertedÂ€. . .Â€The trajectory is the sense in which a,course of action,"has to be grasped, the direction in which one should",0
latour_2013_aime_en,latour,trajectory_pass,trajectories,1,183685,"if we continued to mix up the processes, networks, and",trajectories,"that leave behind “something juridical,” “something scientific,” “something religious.” Even",0
latour_2013_aime_en,latour,trajectory_pass,trajectories,1,186820,of scientific knowledge or religious piety. To designate these different,trajectories,"I have chosen the term preposition, using it in its",0
latour_2013_aime_en,latour,trajectory_pass,discontinuities,1,201337,is that it allows us to compare the types of,discontinuities,"and consequently the trajectories that these discontinuities trace, one pair",0
latour_2013_aime_en,latour,trajectory_pass,trajectories,1,201374,us to compare the types of discontinuities and consequently the,trajectories,"that these discontinuities trace, one pair at a time. In",0
latour_2013_aime_en,latour,trajectory_pass,discontinuities,1,201409,the types of discontinuities and consequently the trajectories that these,discontinuities,"trace, one pair at a time. In this new type",0
latour_2013_aime_en,latour,trajectory_pass,discontinuities,1,201577,comparisons are made by characterizing as precisely as possible the,discontinuities,and hiatuses through which the conti- nuities are obtained. We,0
latour_2013_aime_en,latour,trajectory_pass,trajectory,1,204913,"[pre] type, networks [net] are now only one type of",trajectory,"among others, while the modes have become incompatible, even though",0
latour_2013_aime_en,latour,trajectory_pass,course of action,1,207547,one of the forms through which we can grasp any,course of action,"whatsoever. The freest, to be sure, but not the most",0
latour_2013_aime_en,latour,trajectory_pass,trajectory,1,212694,the rational with the singularity of a particular type of,trajectory,"that the most dangerous and least noticed source of mistakes,",0
latour_2013_aime_en,latour,trajectory_pass,trajectories,1,213544,"the various networks, to which we shall add the various",trajectories,"of veridiction or malediction, each defined by a separate preposition.",0
latour_2013_aime_en,latour,trajectory_pass,trajectory,1,224665,"bore on the identifying passes, identification of a type of",trajectory,whose seeming continuity was actually obtained by a particular way,0
latour_2013_aime_en,latour,trajectory_pass,continuity,1,224690,"identifying passes, identification of a type of trajectory whose seeming",continuity,was actually obtained by a particular way of leaping over,0
latour_2013_aime_en,latour,trajectory_pass,discontinuities,1,224759,was actually obtained by a particular way of leaping over,discontinuities,that were different in each case. We have already identified,0
latour_2013_aime_en,latour,trajectory_pass,continuities,1,225027,"we have also learned that, to resolve the contradiction between",continuities,"and discontinuities, each pass or each mode had defined its",0
latour_2013_aime_en,latour,trajectory_pass,discontinuities,1,225044,"also learned that, to resolve the contradiction between continuities and",discontinuities,each pass or each mode had defined its own forms,0
latour_2013_aime_en,latour,trajectory_pass,leap,1,225203,the conditions for the success or failure of such a,leap,"finally, we have understood that modes can be compared in",0
latour_2013_aime_en,latour,trajectory_pass,trajectories,1,226243,← which allow us the crossing between two types of,trajectories,that to disamalgamate the argument of a correspondence between things,0
latour_2013_aime_en,latour,trajectory_pass,continuity,1,228470,entirely distinct modes of verification while respecting the break in,continuity,that must always distinguish them. Since the argument is frightfully,0
latour_2013_aime_en,latour,trajectory_pass,continuity,1,229923,establish a certain 74 A Perilous Change of Correspondence •,continuity,"Moreover, in cases of uncertainty, the steps of countless hikers",0
latour_2013_aime_en,latour,trajectory_pass,discontinuity,1,231779,coherence that allowed me to “know where I was.” The,discontinuity,of the landmarks ended up producing the continuity of indisputable,0
latour_2013_aime_en,latour,trajectory_pass,continuity,1,231833,was.” The discontinuity of the landmarks ended up producing the,continuity,of indisputable access. For they formed the quite particular type,0
latour_2013_aime_en,latour,trajectory_pass,trajectory,1,235979,will serve to define let us agree to designate their,trajectory,by the expres- chains of reference and sion chains of,0
latour_2013_aime_en,latour,trajectory_pass,discontinuity,1,237391,result of a correspondence that takes place without any discernible,discontinuity,"Quite clearly, the two meanings are both true at the",0
latour_2013_aime_en,latour,trajectory_pass,continuity,1,239477,even as it maintains through a continuous chain of transformations—a,continuity,constantly inter- rupted by the differences between the embedded materials—a,0
latour_2013_aime_en,latour,trajectory_pass,leap,1,240198,introduced his “deambulatory theory of truth”: instead of a “mortal,leap,"between words and things, he said we always find ourselves",0
latour_2013_aime_en,latour,trajectory_pass,discontinuities,1,246258,of refer- ence immediately points both to a series of,discontinuities,"hiatuses, steps, leaps, each of which separates one stage from",0
latour_2013_aime_en,latour,trajectory_pass,leaps,1,246303,"immediately points both to a series of discontinuities, hiatuses, steps,",leaps,"each of which separates one stage from the next, and",0
latour_2013_aime_en,latour,trajectory_pass,continuity,1,246393,"stage from the next, and to the result of a",continuity,that allows access. The lines traced by these chains will,0
latour_2013_aime_en,latour,trajectory_pass,hiatus,1,249706,in the following form: is it possible to identify a,hiatus,"a step, a leap, a pass that will allow us",0
latour_2013_aime_en,latour,trajectory_pass,leap,1,249724,"is it possible to identify a hiatus, a step, a",leap,a pass that will allow us to define existents also,0
latour_2013_aime_en,latour,trajectory_pass,continuity,1,249820,to define existents also as a particular manner of establishing,continuity,through discontinuities? If we were capable of 81 • §1-ch3,0
latour_2013_aime_en,latour,trajectory_pass,discontinuities,1,249839,existents also as a particular manner of establishing continuity through,discontinuities,"If we were capable of 81 • §1-ch3 differentiating them,",0
latour_2013_aime_en,latour,trajectory_pass,trajectories,1,250877,and clothe and materialize the reference-producing networks and their own,trajectories,which seem perfectly orthogonal to the famous Subject/Object relation. If,0
latour_2013_aime_en,latour,trajectory_pass,leap,1,251728,"today, and tomorrow, one thing is certain: it does not",leap,"from one immutable mobile to another in order to discern,",0
latour_2013_aime_en,latour,trajectory_pass,discontinuity,1,251814,"immutable mobile to another in order to discern, through the",discontinuity,"of materials, the maintenance of a geometric constant compatible with",0
latour_2013_aime_en,latour,trajectory_pass,trajectories,1,253164,of existence. We are dealing here with two clearly distinct,trajectories,The confusion was possible only owing to a description of,0
latour_2013_aime_en,latour,trajectory_pass,trajectories,1,254480,the implausibility of requiring that existents themselves pass through such,trajectories,"As soon as the description is made more realistic, more",0
latour_2013_aime_en,latour,trajectory_pass,trajectories,1,257064,"internal to its expansion. Once again, the trace of its",trajectories,provides a much better identification of this internal frontier: however,0
latour_2013_aime_en,latour,trajectory_pass,trajectory,1,258151,beyond of knowledge: either knowledge is truly beyond us—along a,trajectory,different from that of chains of refer- ence—and then we,0
latour_2013_aime_en,latour,trajectory_pass,trajectory,1,260923,authorized. It is a network that traces its own particular,trajectory,"alongside other, differently qualified trajectories, which it never ceases to",0
latour_2013_aime_en,latour,trajectory_pass,trajectories,1,260974,"that traces its own particular trajectory, alongside other, differently qualified",trajectories,which it never ceases to crisscross. 85 • §1-ch3 ←,0
latour_2013_aime_en,latour,trajectory_pass,trajectories,1,263790,the idea of attributing the term “existence” to the two,trajectories,"that cross paths can be surprising, because the tradition passed",0
latour_2013_aime_en,latour,trajectory_pass,hiatus,1,267029,holds—in every sense of the word “hold”! There is a,hiatus,"that the cat has to cross, and that every living",0
latour_2013_aime_en,latour,trajectory_pass,leap,1,267195,with fear and trembling. In addition to this quite particular,leap,on the part of an utterance verified by a state,0
latour_2013_aime_en,latour,trajectory_pass,discontinuity,1,275694,each point we can see the emergence of a double,discontinuity,in the reproduction of the world and in the extension,0
latour_2013_aime_en,latour,trajectory_pass,hiatus,1,278049,of existence through which any entity whatsoever crosses through the,hiatus,"91 • §1-ch3 of its repetition, thus defining from stage",0
latour_2013_aime_en,latour,trajectory_pass,trajectory,1,278240,"its repetition, thus defining from stage to stage a particular",trajectory,with the whole obeying particularly demanding felicity conditions: to be,0
latour_2013_aime_en,latour,trajectory_pass,hiatus,1,278472,"[ref], for reference, the establishment of chains defined by the",hiatus,between two forms of different natures and whose felicity condition,0
latour_2013_aime_en,latour,trajectory_pass,trajectory,1,278700,"maintained across these successive abysses, tracing a different form of",trajectory,that makes it possible to make remote beings accessible by,0
latour_2013_aime_en,latour,trajectory_pass,trajectory,1,278792,it possible to make remote beings accessible by paving the,trajectory,with the two-way movement of immutable mobiles. Readers will better,0
latour_2013_aime_en,latour,trajectory_pass,discontinuities,1,282224,"their thickness, their materiality, their equipment disappear, and all the",discontinuities,required in order to follow them fade away. Once all,0
latour_2013_aime_en,latour,trajectory_pass,discontinuities,1,282470,"if there were no longer any need for transformations, passes,",discontinuities,"And to make matters worse, this is true only once",0
latour_2013_aime_en,latour,trajectory_pass,leap,1,283831,"93 • §1-ch3 you make the absence of any mediation,",leap,"or hiatus pass the one and only test of truth,",0
latour_2013_aime_en,latour,trajectory_pass,hiatus,1,283840,"§1-ch3 you make the absence of any mediation, leap, or",hiatus,"pass the one and only test of truth, then everyone,",0
latour_2013_aime_en,latour,trajectory_pass,discontinuities,1,284398,"of passing through heterogeneity to obtain homogeneity, of introducing scandalous",discontinuities,in what ought to be smooth and continuous. You will,0
latour_2013_aime_en,latour,trajectory_pass,trajectory,1,288504,that we risk confusing [rep] by making this mode one,trajectory,two distinct courses in the idea of matter. among others,0
latour_2013_aime_en,latour,trajectory_pass,hiatus,1,289537,form and the magic of rationalism vanishes that reduces the,hiatus,"of reference, we since we can no longer confuse existents",0
latour_2013_aime_en,latour,trajectory_pass,trajectories,1,290332,"enough room to shelter them all, in par- ticular the",trajectories,"whose autonomy we have just recognized, and among these especially",0
latour_2013_aime_en,latour,trajectory_pass,trajectory,1,294015,"As Whitehead indicates so vividly, no question about such a",trajectory,can be clarified by adding the presence of a human,0
latour_2013_aime_en,latour,trajectory_pass,trajectory,1,296152,"making this Fortunately, the anthropologist of the Moderns mode one",trajectory,is now equipped with a questionnaire that allows her among,0
latour_2013_aime_en,latour,trajectory_pass,trajectories,1,296271,with a questionnaire that allows her among others to determine,trajectories,fairly precisely without having to involve them in the major,0
latour_2013_aime_en,latour,trajectory_pass,discontinuity,1,296601,them). Every instance of conti- nuity is achieved through a,discontinuity,a hiatus; every leap across a discontinuity represents a risk,0
latour_2013_aime_en,latour,trajectory_pass,hiatus,1,296618,"instance of conti- nuity is achieved through a discontinuity, a",hiatus,every leap across a discontinuity represents a risk taken that,0
latour_2013_aime_en,latour,trajectory_pass,leap,1,296632,"conti- nuity is achieved through a discontinuity, a hiatus; every",leap,across a discontinuity represents a risk taken that may succeed,0
latour_2013_aime_en,latour,trajectory_pass,discontinuity,1,296657,"achieved through a discontinuity, a hiatus; every leap across a",discontinuity,represents a risk taken that may succeed or fail; there,0
latour_2013_aime_en,latour,trajectory_pass,leap,1,296874,"result of this passage, of this more or less successful",leap,"is a flow, a network, a movement, a wake left",0
latour_2013_aime_en,latour,trajectory_pass,hiatus,1,298269,"lineages, two distinct ways of defining the minuscule or massive",hiatus,that separates their antecedents from their consequents. The difference between,0
latour_2013_aime_en,latour,trajectory_pass,hiatus,1,299058,"these entities form lines, alignments, it is because, despite the",hiatus,despite the leap from one instant to the next (a,0
latour_2013_aime_en,latour,trajectory_pass,leap,1,299078,"lines, alignments, it is because, despite the hiatus, despite the",leap,from one instant to the next (a leap impossible for,0
latour_2013_aime_en,latour,trajectory_pass,leap,1,299115,despite the leap from one instant to the next (a,leap,"impossible for human eyes to discern), each occasion inherits something",0
latour_2013_aime_en,latour,trajectory_pass,hiatus,1,301661,The price to pay for the discovery of such a,hiatus,"is not as great as it appears, if we are",0
latour_2013_aime_en,latour,trajectory_pass,continuity,1,302830,immense advantage of being freed from any ultraworld—substance—without loss of,continuity,"in being—subsis- tence. There is nothing beneath, nothing behind or",0
latour_2013_aime_en,latour,trajectory_pass,hiatus,1,302965,"beneath, nothing behind or above. No transcen- dence but the",hiatus,of reproduction. This newly acquired freedom of movement (in the,0
latour_2013_aime_en,latour,trajectory_pass,trajectories,1,303716,is important to us here is simply to situate the,trajectories,"of reproduction outside the stifling clutch of a “material world,”",0
latour_2013_aime_en,latour,trajectory_pass,leaps,1,304159,will suffice to keep us from smoothing over all the,leaps,"with the notion, though it is a very widespread one—we",0
latour_2013_aime_en,latour,trajectory_pass,leap,1,313151,—and the requirements of subsistence—maintenance in exis- tence through the,leap,of reproduction. It is as if the mode of displace-,0
latour_2013_aime_en,latour,trajectory_pass,continuity,1,315010,transformations that ensure the discovery and the maintenance of constants:,continuity,of access depends on discontinuities. This is the only means—but,0
latour_2013_aime_en,latour,trajectory_pass,discontinuities,1,315042,and the maintenance of constants: continuity of access depends on,discontinuities,This is the only means—but a means whose practical discovery,0
latour_2013_aime_en,latour,trajectory_pass,hiatus,1,317087,of the term (it is interesting to note that in,hiatus,of reference French forme and fromage have the same root).,0
latour_2013_aime_en,latour,trajectory_pass,continuity,1,319435,successive embeddings allows this highly paradoxical back-and-forth movement that obtains,continuity,of reference (the runner) through the discon- tinuity of the,0
latour_2013_aime_en,latour,trajectory_pass,discontinuities,1,325860,"at all, necessarily had to pass through a series of",discontinuities,"[rep] to achieve continuity. To obtain being, other- ness is",0
latour_2013_aime_en,latour,trajectory_pass,continuity,1,325893,to pass through a series of discontinuities [rep] to achieve,continuity,"To obtain being, other- ness is required. Sameness is purchased,",0
latour_2013_aime_en,latour,trajectory_pass,discontinuities,1,326045,"as it were, at the price of alter- ations. These",discontinuities,are totally different from those of forms in the sense,0
latour_2013_aime_en,latour,trajectory_pass,trajectories,1,326752,"cat, mountain, yeasts, and even the philosopher) move along surprising",trajectories,"yes, networks, composed, as we have just seen, of their",0
latour_2013_aime_en,latour,trajectory_pass,leap,1,326892,"and their consequents separated by a slight gap, a little",leap,"It just may be tempting, however, to erase these discontinuities,",0
latour_2013_aime_en,latour,trajectory_pass,discontinuities,1,326953,"leap. It just may be tempting, however, to erase these",discontinuities,"these filiations, these risks, in their turn (we shall soon",0
latour_2013_aime_en,latour,trajectory_pass,hiatus,1,327202,"them. Now, as soon as we fail to note the",hiatus,"of persistence in being, we are surreptitiously introducing a substance",0
latour_2013_aime_en,latour,trajectory_pass,continuity,1,327517,more durable than they are and that would ensure their,continuity,"without having to take the trouble, themselves, to leap over",0
latour_2013_aime_en,latour,trajectory_pass,leap,1,327579,"their continuity without having to take the trouble, themselves, to",leap,over the discontinuities required for existence. We would be starting,0
latour_2013_aime_en,latour,trajectory_pass,discontinuities,1,327593,"having to take the trouble, themselves, to leap over the",discontinuities,required for existence. We would be starting from a passage,0
latour_2013_aime_en,latour,trajectory_pass,leaps,1,328715,"you eliminate all the risks, all the movements, all the",leaps,You explain in a single stroke the famous correspondence between,0
latour_2013_aime_en,latour,trajectory_pass,trajectories,1,337300,"that is to say, let us not forget, of the",trajectories,and the networks. 114 Learning to Make Room • And,0
latour_2013_aime_en,latour,trajectory_pass,hiatus,1,347551,recall the point of departure: erasing the two types of,hiatus,"of breaks in continuity, of mediations that make the detection",0
latour_2013_aime_en,latour,trajectory_pass,continuity,1,347572,"departure: erasing the two types of hiatus, of breaks in",continuity,of mediations that make the detection of constants allowing access,0
latour_2013_aime_en,latour,trajectory_pass,discontinuities,1,347729,to remote beings [ref] as risky as the discovery of,discontinuities,that permit subsistence [rep]. With one stroke of the magic,0
latour_2013_aime_en,latour,trajectory_pass,leap,1,349462,concatenations of causes and effects in which even the little,leap,"the little break in continuity, the hiatus between cause and",0
latour_2013_aime_en,latour,trajectory_pass,continuity,1,349488,"in which even the little leap, the little break in",continuity,"the hiatus between cause and effect, had disappeared—necessarily, because the",0
latour_2013_aime_en,latour,trajectory_pass,hiatus,1,349504,"even the little leap, the little break in continuity, the",hiatus,"between cause and effect, had disappeared—necessarily, because the relay, as",0
latour_2013_aime_en,latour,trajectory_pass,leaps,1,352088,"transfusion of res ratiocinans, the common-sense world, with all those",leaps,"discontinuities, and unex- pected branchings, closely resembles the quantum worlds.",0
latour_2013_aime_en,latour,trajectory_pass,discontinuities,1,352095,"of res ratiocinans, the common-sense world, with all those leaps,",discontinuities,"and unex- pected branchings, closely resembles the quantum worlds. Except",0
latour_2013_aime_en,latour,trajectory_pass,hiatus,1,364035,"without fanfare? There would be no break in reasoning, no",hiatus,"in expression, no turns of phrase or circumlocutions, no impromptu",0
