obra,autor_yaml,grupo,termo_encontrado,pagina,posicao_no_texto,contexto_antes,trecho_central,contexto_depois,descartado_por_exclusao
latour_2013_aime_en,latour,modes_of_existence,modes of existence,1,17,An Inquiry into,Modes of Existence,An Inquiry into Modes of Existence An Anthropology of the,0
latour_2013_aime_en,latour,modes_of_existence,modes of existence,1,62,An Inquiry into Modes of Existence An Inquiry into,Modes of Existence,An Anthropology of the Moderns · bruno latour · Translated,0
latour_2013_aime_en,latour,modes_of_existence,modes of existence,1,1187,Bruno. [Enquête sur les modes d'existence. English] An inquiry into,modes of existence,: an anthropology of the moderns / Bruno Latour ;,0
latour_2013_aime_en,latour,modes_of_existence,modes of existence,1,3686,involving speech acts (17) while we learn to identify different,modes of existence,"(19). The goal is, first, to accompany a people vacillating",0
latour_2013_aime_en,latour,modes_of_existence,modes of existence,1,4087,• Part One How to Make an Inquiry into the,Modes of Existence,of the Moderns Possible ·Chapter 1· Defining the Object of,0
latour_2013_aime_en,latour,modes_of_existence,mode of existence,1,4725,from networks as process (31). The inquiry defines a first,mode of existence,"the network [net], through a particular “pass,” or passage (33).",0
latour_2013_aime_en,latour,modes_of_existence,modes of existence,1,7683,"identifying passes (73), which allow us to disamalgamate two distinct",modes of existence,(73). Description of an unremarkable itinerary: the example of a,0
latour_2013_aime_en,latour,modes_of_existence,"modes
of existence",1,8242,of chains of reference [ref] (83) there are indeed two,"modes
of existence",that co-respond to each other (86). We must therefore register,0
latour_2013_aime_en,latour,modes_of_existence,mode of existence,1,8551,of the laboratory (89). Hence the salience of a new,mode of existence,"[rep], for reproduction (91) and of a crossing [repâ•›·â•›ref] that",0
latour_2013_aime_en,latour,modes_of_existence,modes of existence,1,12545,that we treat the notion of sign with skepticism (145).,Modes of existence,"are indeed at stake, and there are more than two",0
latour_2013_aime_en,latour,modes_of_existence,modes of existence,1,14923,• part Two How to Benefit from the Pluralism of,Modes of Existence,·Chapter 7· Reinstituting the Beings of Metamorphosis. . . .,0
latour_2013_aime_en,latour,modes_of_existence,mode of existence,1,17009,"terms of networks [tecâ•›·â•›net] (212), the detection of an original",mode of existence,(214) different from reproduction [repâ•›·â•›tec] (215). We need to return,0
latour_2013_aime_en,latour,modes_of_existence,mode of existence,1,17668,form of invisibility (222): the technological labyrinth (223). xi Its,mode of existence,depends on the [metâ•›·â•›tec] ruse (224) as much as on,0
latour_2013_aime_en,latour,modes_of_existence,modes of existence,1,18326,. . . . . . . 233 Multiplying the,modes of existence,"implies draining language of its importance (234), which is the",0
latour_2013_aime_en,latour,modes_of_existence,mode of existence,1,20056,re- sist the temptations of Occidentalism (261). Is there a,mode of existence,"proper to essence? (262) The most widespread mode of all,",0
latour_2013_aime_en,latour,modes_of_existence,mode of existence,1,20225,"prepositions while omitting them (264), habit [hab], too, is a",mode of existence,(265) with a paradoxical hiatus that produces immanence (266). By,0
latour_2013_aime_en,latour,modes_of_existence,mode of existence,1,20378,experience of an attentive habit (267) we see how this,mode of existence,manages to trace continuities (268) owing to its particular felicity,0
latour_2013_aime_en,latour,modes_of_existence,mode of existence,1,20830,has its own way of playing with habits (275). This,mode of existence,"can help define institutions positively (277), provided that we take",0
latour_2013_aime_en,latour,modes_of_existence,modes of existence,1,21134,"the temptation of fundamentalism (280). ·Conclusion, Part Two· Arranging the",Modes of Existence,. . . . . . . . . .,0
latour_2013_aime_en,latour,modes_of_existence,mode of existence,1,28320,is necessarily to dis/reorganize (393). Here we have a distinct,mode of existence,(393) with its own explicit felicity and infelicity conditions (395),0
latour_2013_aime_en,latour,modes_of_existence,"modes of
existence",1,34243,brought together under the code name aime: An Inquiry into,"Modes of
Existence",the English translation of the French eme: Enquête sur les,0
latour_2013_aime_en,latour,modes_of_existence,modes of existence,1,41152,"to profit, in Part xxv Two, from the pluralism of",modes of existence,"and to get ourselves out of the prison, first, of",0
latour_2013_aime_en,latour,modes_of_existence,modes of existence,1,45221,we have to choose → by proposing a identify different,modes of existence,"different system of coordinates. The goal is, first, to accompany",0
latour_2013_aime_en,latour,modes_of_existence,modes of existence,1,88198,category mistakes bearing on what I have called the various,modes of existence,"By comparing conflicts of values in pairs—scientific versus religious, for",0
latour_2013_aime_en,latour,modes_of_existence,mode of existence,1,89843,"to me, for the reader: does the redescription of a",mode of existence,make it possible to clear up conflicts between values—conflicts that,0
latour_2013_aime_en,latour,modes_of_existence,modes of existence,1,93200,different rationalism has not been able to define the adven-,modes of existence,"ture of modernization in which it has nevertheless, at least",0
latour_2013_aime_en,latour,modes_of_existence,"modes
of existence",1,93924,is no use hiding the fact that the question of,"modes
of existence","has to do with metaphysics or, better, ontology—regional matters, to",0
latour_2013_aime_en,latour,modes_of_existence,modes of existence,1,96834,the Real will recognize its own!” To speak of different,modes of existence,and claim to be investi- gating these modes with a,0
latour_2013_aime_en,latour,modes_of_existence,modes of existence,1,99184,not been able to see any way this inquiry into,modes of existence,"could do without philosophy. I am turning to philosophy, then,",0
latour_2013_aime_en,latour,modes_of_existence,modes of existence,1,105393,part 1 • How to Make an Inquiry into the,Modes of Existence,of the Moderns Possible ·Chapter 1· Defining the Object of,0
latour_2013_aime_en,latour,modes_of_existence,mode of existence,1,121966,a more specific: it designates a series of associations first,mode of existence,revealed thanks to a trial—consisting in the surprises the network,0
latour_2013_aime_en,latour,modes_of_existence,modes of existence,1,215304,"there of method that entail identifying passes, are indeed two",modes of existence,that which allow us to disamalgamate two co-respond to each,0
latour_2013_aime_en,latour,modes_of_existence,modes of existence,1,215411,allow us to disamalgamate two co-respond to each other. distinct,modes of existence,We must therefore register new felicity Description of an unremarkable,0
latour_2013_aime_en,latour,modes_of_existence,modes of existence,1,261222,"indeed two And now, finally, we can talk about correspond-",modes of existence,"ence again, but this “co-response” is no longer the that",0
latour_2013_aime_en,latour,modes_of_existence,modes of existence,1,263452,"“thing,” completely, and to speak from now on only of",modes of existence,all real and all capable of truth and falsity—but each,0
latour_2013_aime_en,latour,modes_of_existence,modes of existence,1,263686,going to begin to understand why our inquiry bears on,modes of existence,"At first glance, the idea of attributing the term “existence”",0
latour_2013_aime_en,latour,modes_of_existence,mode of existence,1,265016,representations to come: we need to harmonize the notion of,mode of existence,"with the work of reference, and, conversely, recognize in existents",0
latour_2013_aime_en,latour,modes_of_existence,modes of existence,1,268331,simply to accept the project of an inquiry into the,modes of existence,an inquiry that will proceed step-by-step and in step with,0
latour_2013_aime_en,latour,modes_of_existence,"mode
           of existence",1,269268,"reference, by granting it the ontological dignity of being a","mode
           of existence","but while refusing to allow it to substitute itself, through",0
latour_2013_aime_en,latour,modes_of_existence,modes of existence,1,272818,we have an example of what it means for two,modes of existence,"to interact to some extent, to correspond to one another",0
latour_2013_aime_en,latour,modes_of_existence,mode of existence,1,276377,depriving it of the possibility of being taken as a,mode of existence,that is complete in its kind. Is it really praising,0
latour_2013_aime_en,latour,modes_of_existence,mode of existence,1,277975,"(stressing the “re” of re-production), as the name for the",mode of existence,through which any entity whatsoever crosses through the hiatus 91,0
latour_2013_aime_en,latour,modes_of_existence,mode of existence,1,301121,"point at least, the quarrel of the Universals. If each",mode of existence,defines a form of alteration through which one must pass,0
latour_2013_aime_en,latour,modes_of_existence,modes of existence,1,310945,of a space so invasive that it would stifle all,modes of existence,"As if the Flood had devastated everything, and there were",0
latour_2013_aime_en,latour,modes_of_existence,modes of existence,1,314564,not that there is indeed now room to accommodate other,modes of existence,rather than simply multiple representations of a single world.) 106,0
latour_2013_aime_en,latour,modes_of_existence,modes of existence,1,331503,order to continue to exist. We shall skip over both,modes of existence,"[repâ•›·â•›ref] at once. This time, there will be nothing painful",0
latour_2013_aime_en,latour,modes_of_existence,modes of existence,1,357450,"possible, and ensures no protection whatsoever for the deployment of",modes of existence,"In the face of this institution, anthropology (conjugated with militancy,",0
latour_2013_aime_en,latour,modes_of_existence,modes of existence,1,360033,a Circle that the course of reference cannot judge properly.,Modes of existence,"are indeed at stake, and there are more than two",0
latour_2013_aime_en,latour,modes_of_existence,mode of existence,1,382341,knows the three criteria by which one can recognize a,mode of existence,"First, thanks to a category mistake: she feels vaguely, in",0
latour_2013_aime_en,latour,modes_of_existence,mode of existence,1,383142,conditions that would make it possible to say of a,mode of existence,in its own idiom under what conditions it is truthful,0
latour_2013_aime_en,latour,modes_of_existence,"mode
of existence",1,391487,to do nothing but lie for all time. In this,"mode
of existence","there is something sui generis, in the literal sense of",0
latour_2013_aime_en,latour,modes_of_existence,mode of existence,1,419295,we are beginning to identify the junctures proper to each,mode of existence,144 Removing Some Speech Impediments • Our anthropologist probably jotted,0
latour_2013_aime_en,latour,modes_of_existence,modes of existence,1,422715,on reality despite the supposed chasm between words and things.,Modes of existence,It is precisely in order to give up the sign/thing,0
latour_2013_aime_en,latour,modes_of_existence,mode of existence,1,422919,I have chosen to speak of and there are more,mode of existence,"a term introduced into philos- than two of these, ophy",0
latour_2013_aime_en,latour,modes_of_existence,"modes
           of existence",1,423204,"to speak of commerce, crossings, misunderstandings, amalgams, hybrids, compromises between","modes
           of existence",(made comparable in this sense according to the mode of,0
latour_2013_aime_en,latour,modes_of_existence,mode of existence,1,434485,redefine their values differently—through the now well understood notion of,mode of existence,begin to of- fer alternative accounts (which will be the,0
latour_2013_aime_en,latour,modes_of_existence,modes of existence,1,448418,themselves! It is one thing to recognize the differences between,modes of existence,by jealously retaining the multiplicity of types of veridiction; it’s,0
latour_2013_aime_en,latour,modes_of_existence,modes of existence,1,448864,that of confusing respect for the various alterations of the,modes of existence,with the resources of critical thought. Thus to escape from,0
latour_2013_aime_en,latour,modes_of_existence,"modes of
             existence",1,467579,"using our previously estab- lished method, the crossing between two","modes of
             existence","to which I have already alluded, though too rapidly, reli-",0
latour_2013_aime_en,latour,modes_of_existence,mode of existence,1,473798,"that, in order to extract the contrast from a new",mode of existence,very poorly characterized but neverthe- less instituted in history under,0
latour_2013_aime_en,latour,modes_of_existence,modes of existence,1,505502,"there? From the start, haven’t we managed to allow several",modes of existence,"to run, flow, pass, each one appearing indeed to possess",0
latour_2013_aime_en,latour,modes_of_existence,modes of existence,1,506499,of the prepositions [pre]. Do we not have here two,modes of existence,"both also distinct, both also complete, each in its own",0
latour_2013_aime_en,latour,modes_of_existence,modes of existence,1,507650,to throw ourselves into the enter- prise of capturing the,modes of existence,thanks to which the Moderns could get a new grip,0
latour_2013_aime_en,latour,modes_of_existence,modes of existence,1,510273,part 2 • How to Benefit from the Pluralism of,Modes of Existence,·Chapter 7· Reinstituting the Beings of Metamorphosis We are going,0
latour_2013_aime_en,latour,modes_of_existence,mode of existence,1,514110,way and the wrong way to grasp the mode. A,mode of existence,182 Reinstituting the Beings of Metamorphosis • is thus always,0
latour_2013_aime_en,latour,modes_of_existence,mode of existence,1,516713,is a good opportunity to see whether the notion of,mode of existence,allows us to see the picture more clearly. 183 •,0
latour_2013_aime_en,latour,modes_of_existence,mode of existence,1,553454,"And thus we have, as a first approximation, an original",mode of existence,"that we shall note from here on as [met], for",0
latour_2013_aime_en,latour,modes_of_existence,modes of existence,1,573285,"will never be able to replace, engender, or produce. Two",modes of existence,"that are not “primitive” but on the contrary prodigiously advanced,",0
latour_2013_aime_en,latour,modes_of_existence,mode of existence,1,578267,"addition to an analysis in terms of networks [tecâ•›·â•›net], Its",mode of existence,depends on the detection of an original mode of the,0
latour_2013_aime_en,latour,modes_of_existence,mode of existence,1,580980,had already broken the path in his book On the,Mode of Existence,"of Technical Objects, a text as famous as it is",0
latour_2013_aime_en,latour,modes_of_existence,mode of existence,1,585062,and on their particular If we can hesitate over the,mode of existence,of form of transcendence reproduction [rep] (because its persistence hides,0
latour_2013_aime_en,latour,modes_of_existence,mode of existence,1,588381,"but secondary, and it too depends on a very particular",mode of existence,"as we shall see in Chapter 10. The world, or",0
latour_2013_aime_en,latour,modes_of_existence,modes of existence,1,588952,of “Objects” and “Subjects” as her only resources. In comparing,modes of existence,"she is complicating her task, to be sure, since she",0
latour_2013_aime_en,latour,modes_of_existence,mode of existence,1,589343,genius lay in seeing that one could not specify the,mode of existence,of technological beings without titrating them 211 • §2-ch8 thanks,0
latour_2013_aime_en,latour,modes_of_existence,modes of existence,1,590232,"out, following the articulations of the creature itself, all the",modes of existence,without condemning any one of them to the cutting-room floorÂ€.,0
latour_2013_aime_en,latour,modes_of_existence,mode of existence,1,596006,we are not necessarily coming closer of existence to a,mode of existence,"other than that of networks. There is indeed discontinuity, there",0
latour_2013_aime_en,latour,modes_of_existence,mode of existence,1,596442,we are simply following the logic of this already well-demarcated,mode of existence,Even if he does no more than look around in,0
latour_2013_aime_en,latour,modes_of_existence,mode of existence,1,606579,"Contrary to the title of Simondon’s book, it isn’t the",mode of existence,of the technological object that we must address but the,0
latour_2013_aime_en,latour,modes_of_existence,mode of existence,1,606665,of the technological object that we must address but the,mode of existence,"of technology, of technological beings themselves. (Let us recall that,",0
latour_2013_aime_en,latour,modes_of_existence,mode of existence,1,623469,to the mode of technological existence? 223 • §2-ch8 Its,mode of existence,"If technology, like the metamorphoses we have depends on the",0
latour_2013_aime_en,latour,modes_of_existence,modes of existence,1,635511,"that comes to interrupt, bend, deflect, cut out the other",modes of existence,and thus by a clever ploy introduces a differential of,0
latour_2013_aime_en,latour,modes_of_existence,modes of existence,1,646712,232 ·Chapter 9· Situating the Beings of Fiction Multiplying the,modes of existence,We are the offspring of our works. implies draining language,0
latour_2013_aime_en,latour,modes_of_existence,modes of existence,1,648498,can be derived from draining language of the pluralism of,modes of existence,"if its importance, for each mode we cut out a",0
latour_2013_aime_en,latour,modes_of_existence,mode of existence,1,657517,signs? Let us say that a sign emanates from a,mode of existence,in due form. Whereas the sense comes ahead of the,0
latour_2013_aime_en,latour,modes_of_existence,modes of existence,1,669537,"fillers—Nature, Society, Language—that were keeping it from giving the various",modes of existence,"their proper weight of being. As in Japanese paintings, the",0
latour_2013_aime_en,latour,modes_of_existence,mode of existence,1,674746,"and figures, way they have of extending themselves. For each",mode of existence,is in fact a mode of extension. How are we,0
latour_2013_aime_en,latour,modes_of_existence,mode of existence,1,677587,forget the stunning originality of fiction. Here we have a,mode of existence,"like no other, defined by hesi- tation, vacillation, back-and-forth movements,",0
latour_2013_aime_en,latour,modes_of_existence,mode of existence,1,686131,"works of fiction, their proper ontological dignity, which no other",mode of existence,can replace. It was a stroke of genius on the,0
latour_2013_aime_en,latour,modes_of_existence,modes of existence,1,707869,"the result, merely glimpsed, of the proliferation of the other",modes of existence,"fiction indeed always takes on obliquely. Following this logic, the",0
latour_2013_aime_en,latour,modes_of_existence,mode of existence,1,715370,"hide. Occidentalism. We understand quite differently, then, Is there a",mode of existence,"proper to the distance between theory and practice, essence? which",0
latour_2013_aime_en,latour,modes_of_existence,mode of existence,1,715906,of existence with a paradoxical hiatus that produces immanence. This,mode of existence,"can help define institutions positively, provided that we By following",0
latour_2013_aime_en,latour,modes_of_existence,modes of existence,1,720059,"system of dosages and dietary advice, a whole pharmacopeia of",modes of existence,with which we would have to familiarize ourselves in order,0
latour_2013_aime_en,latour,modes_of_existence,modes of existence,1,722927,"essence is raised. Socrates, during his own inquiry into the",modes of existence,annoyed all the tradesmen of Athens by claiming he could,0
latour_2013_aime_en,latour,modes_of_existence,mode of existence,1,726850,we now have to ask ourselves the question of the,mode of existence,of essence. The most widespread The question may look like,0
latour_2013_aime_en,latour,modes_of_existence,modes of existence,1,727364,"most important, the most widespread, the most indispensable of the",modes of existence,"the one that takes up 99 percent of our lives,",0
latour_2013_aime_en,latour,modes_of_existence,mode of existence,1,730209,"← habit [hab], too, is a can’t be a real",mode of existence,"But it is! And the mode of existence most common,",0
latour_2013_aime_en,latour,modes_of_existence,mode of existence,1,730258,a real mode of existence!” But it is! And the,mode of existence,"most common, the most familiar of all, the one that",0
latour_2013_aime_en,latour,modes_of_existence,"mode of
        existence",1,733960,proves that even immanence needs to be engendered by a,"mode of
        existence",that is proper to it. If it is true that,0
latour_2013_aime_en,latour,modes_of_existence,modes of existence,1,735514,Click [habâ•›·â•›dc]. But let us not forget that all the,modes of existence,"are paradoxical, each in its own way, as perceived by",0
latour_2013_aime_en,latour,modes_of_existence,mode of existence,1,738220,it care- fully. Let us say that habit is the,mode of existence,that veils all modes of existence—including its own. ← we,0
latour_2013_aime_en,latour,modes_of_existence,"modes of
                              existence",1,738253,that habit is the mode of existence that veils all,"modes of
                              existence",its own. ← we see how this mode It is,0
latour_2013_aime_en,latour,modes_of_existence,mode of existence,1,739644,"because there is a discontinuity, a leap, and thus a",mode of existence,a type of alteration. The special contribution of habit is,0
latour_2013_aime_en,latour,modes_of_existence,mode of existence,1,740071,precedes essence” but that behaving like an essence is a,mode of existence,a way of being that cannot be substituted for any,0
latour_2013_aime_en,latour,modes_of_existence,mode of existence,1,760440,pathway every time [netâ•›·â•›pre]. That would be too simple: each,mode of existence,has its own 275 • §2-ch10 way of unfolding and,0
latour_2013_aime_en,latour,modes_of_existence,mode of existence,1,764893,“ forgetting being” is not a general category mistake: each,mode of existence,requires that it be forgotten in its own way. Here,0
latour_2013_aime_en,latour,modes_of_existence,"modes
of existence",1,764990,its own way. Here we have a whole ethology of,"modes
of existence",that the Moderns have learned to recognize and that may,0
latour_2013_aime_en,latour,modes_of_existence,mode of existence,1,765236,"be said that if habit is so important, it This",mode of existence,must have received a particularly careful treatment can help define,0
latour_2013_aime_en,latour,modes_of_existence,mode of existence,1,766236,"that of forgetting. Now, this distinction, internal to this particular",mode of existence,must not be confused with another that has recently been,0
latour_2013_aime_en,latour,modes_of_existence,modes of existence,1,776829,"equal in their ignorance? 281 ·conclusion, part two· Arranging the",modes of existence,Wherein we encounter an unexpected A second group revolves around,0
latour_2013_aime_en,latour,modes_of_existence,modes of existence,1,777859,she begins to deploy the plurality of an unexpected problem,modes of existence,the anthropolo- of arrangement. gist of the Moderns comes across,0
latour_2013_aime_en,latour,modes_of_existence,modes of existence,1,779757,little choice: any alternative system of coordinates 284 Arranging the,Modes of Existence,• will be preferable to the current one—and preferable to,0
latour_2013_aime_en,latour,modes_of_existence,modes of existence,1,785364,dignity that explains both their intimidating objectivity 286 Arranging the,Modes of Existence,"• (they can change us into another at any time),",0
latour_2013_aime_en,latour,modes_of_existence,modes of existence,1,791025,"[ref], from Chapters 3 and 4. Without 288 Arranging the",Modes of Existence,"• the first, it would be impossible to form or",0
latour_2013_aime_en,latour,modes_of_existence,mode of existence,1,791917,what first has to be engendered by a very particular,mode of existence,"a shifting outward of the utterance, the speaker, and the",0
latour_2013_aime_en,latour,modes_of_existence,mode of existence,1,794797,consisting of distinct layers that have been engendered by each,mode of existence,We have seen that one could gain interiority through the,0
latour_2013_aime_en,latour,modes_of_existence,modes of existence,1,796776,should always have remained just a convenience 290 Arranging the,Modes of Existence,• of organization: some modes are more centripetal with respect,0
latour_2013_aime_en,latour,modes_of_existence,modes of existence,1,799541,"the originality of the true Moderns. Thus, by deploying the",modes of existence,"according to this classification, we can sketch out an already",0
latour_2013_aime_en,latour,modes_of_existence,"modes of
      existence",1,802665,"other, without using any system of coordinates except that of","modes of
      existence","By using the term collective, as we have done up",0
latour_2013_aime_en,latour,modes_of_existence,"mode
of existence",1,826740,has to take this new hiatus as proof of a,"mode
of existence",that is truly sui generis. In all the sermons about,0
